<!ELEMENT Tabuleiro (PecasPretas, PecasBrancas)>
		<!ELEMENT PecasPretas (Peca*)>
		<!ELEMENT PecasBrancas (Peca*)>
		<!ELEMENT Peca (posição)>
		<!ATTLIST Peca
				id CDATA #REQUIRED
				tipo CDATA #REQUIRED
				>
		<!ELEMENT posição (#PCDATA)>
